<?xml version="1.0" encoding="UTF-8"?>
<xsd:schema xmlns:xsd="http://www.w3.org/2001/XMLSchema" elementFormDefault="qualified">

  <xsd:element name="school">
    <xsd:complexType>
      <xsd:sequence>
        <xsd:element name="name" type="xsd:string"/>
        <xsd:element name="locations">
          <xsd:complexType>
            <xsd:sequence>
              <xsd:element name="location" type="xsd:string" maxOccurs="unbounded"/>
            </xsd:sequence>
          </xsd:complexType>
        </xsd:element>
        <xsd:element name="staffs">
          <xsd:complexType>
            <xsd:sequence>
              <xsd:element name="staff" type="staffType" maxOccurs="unbounded"/>
            </xsd:sequence>
          </xsd:complexType>
        </xsd:element>
        <xsd:element name="subjects">
          <xsd:complexType>
            <xsd:sequence>
              <xsd:element name="subject" type="subjectType" maxOccurs="unbounded"/>
            </xsd:sequence>
          </xsd:complexType>
        </xsd:element>
      </xsd:sequence>
      <xsd:attribute name="id" type="xsd:ID" use="required"/>
    </xsd:complexType>
  </xsd:element>

  <xsd:complexType name="staffType">
    <xsd:sequence>
      <xsd:element name="name" type="xsd:string"/>
      <xsd:element name="title" type="xsd:string" minOccurs="0"/>
      <xsd:element name="category">
        <xsd:simpleType>
          <xsd:restriction base="xsd:string">
            <xsd:enumeration value="academic"/>
            <xsd:enumeration value="general"/>
            <xsd:enumeration value="technical"/>
          </xsd:restriction>
        </xsd:simpleType>
      </xsd:element>
      <xsd:element name="address" type="addressType" maxOccurs="unbounded"/>
    </xsd:sequence>
    <xsd:attribute name="id" type="xsd:ID" use="required"/>
  </xsd:complexType>

  <xsd:complexType name="addressType">
    <xsd:sequence>
      <xsd:element name="street" type="xsd:string"/>
      <xsd:element name="suburb" type="xsd:string"/>
      <xsd:element name="postcode" type="xsd:integer"/>
    </xsd:sequence>
  </xsd:complexType>

  <xsd:complexType name="subjectType">
    <xsd:sequence>
      <xsd:element name="name" type="xsd:string"/>
      <xsd:element name="description" type="xsd:string"/>
      <xsd:element name="capacity">
        <xsd:simpleType>
          <xsd:restriction base="xsd:integer">
            <xsd:minInclusive value="6"/>
            <xsd:maxInclusive value="400"/>
          </xsd:restriction>
        </xsd:simpleType>
      </xsd:element>
      <xsd:element name="Staff-Ref" maxOccurs="unbounded">
        <xsd:complexType>
          <xsd:attribute name="id" type="xsd:IDREF" use="required"/>
        </xsd:complexType>
      </xsd:element>
    </xsd:sequence>
    <xsd:attribute name="id" type="xsd:ID" use="required"/>
  </xsd:complexType>

</xsd:schema>
